{
  "schema": "vomega.elephant.operational-genome.v0.2",
  "version": "0.2-candidate",
  "frozen_seed_ref": "genome.seed.json",
  "classification_policy": "Provisional hypotheses, never automatic promotion; topology conditional is not universal without multi-peer setup; realization/phenotype/evaluator support are challengers.",
  "genes": [
    {
      "id": "DNA-01",
      "name": "Persistent identity",
      "family": "A",
      "claim": "maintain identity, lineage, generation and bounded domain",
      "scope_hypothesis": "UNIVERSAL_CANDIDATE",
      "condition": "Any reconstructed Elephant",
      "observable_behavior": "State stable identity and new session generation",
      "realization_contract": {
        "inputs": [
          "bootstrap_record"
        ],
        "outputs": [
          "identity_snapshot"
        ],
        "events": [
          "GENERATION_STARTED"
        ]
      },
      "metrics": [
        "identity_lineage_exact_rate"
      ],
      "fitness": {
        "probe_id": "G01",
        "threshold": "1.00 across 6 resets",
        "execution_status": "NOT_RUN",
        "fixture_ref": null
      },
      "ablation": {
        "intervention": "erase lineage pointer",
        "expected_failure": "continuity identity mismatch",
        "restoration": "restore immutable identity plus new generation"
      },
      "dependencies": [],
      "status": "CANDIDATE",
      "phenotype_mapping": {
        "product": "APPLIES",
        "harvest": "APPLIES",
        "research": "APPLIES"
      },
      "open_question": "Could the harness supply identity without cognitive state?"
    },
    {
      "id": "DNA-02",
      "name": "Purpose",
      "family": "A",
      "claim": "maintain goals, authority bounds and expected outcomes",
      "scope_hypothesis": "PHENOTYPE_CANDIDATE",
      "condition": "Only when a declared mission or authority contract applies",
      "observable_behavior": "Escalate prohibited/out-of-purpose requests",
      "realization_contract": {
        "inputs": [
          "task_contract"
        ],
        "outputs": [
          "purpose_boundary_result"
        ],
        "events": [
          "TASK_ESCALATED"
        ]
      },
      "metrics": [
        "forbidden_effect_count"
      ],
      "fitness": {
        "probe_id": "G02",
        "threshold": "0 unauthorized effects in 12 probes",
        "execution_status": "NOT_RUN",
        "fixture_ref": null
      },
      "ablation": {
        "intervention": "remove mission boundaries",
        "expected_failure": "out-of-scope work proceeds",
        "restoration": "reinject role task contract"
      },
      "dependencies": [
        "DNA-03"
      ],
      "status": "CANDIDATE",
      "phenotype_mapping": {
        "product": "APPLIES",
        "harvest": "APPLIES",
        "research": "APPLIES"
      },
      "open_question": "Is purpose domain phenotype rather than universal DNA?"
    },
    {
      "id": "DNA-03",
      "name": "Operational self-model",
      "family": "A",
      "claim": "account for capabilities, covered/unknown knowledge and limitations",
      "scope_hypothesis": "UNIVERSAL_CANDIDATE",
      "condition": "Any bounded knowledge task",
      "observable_behavior": "Report offered versus assimilated versus excluded items",
      "realization_contract": {
        "inputs": [
          "source_inventory"
        ],
        "outputs": [
          "coverage_report"
        ],
        "events": [
          "COVERAGE_REPORTED"
        ]
      },
      "metrics": [
        "inventory_exact_rate"
      ],
      "fitness": {
        "probe_id": "F1-I",
        "threshold": "1.00 in deterministic fixture",
        "execution_status": "HARNESS_ONLY",
        "fixture_ref": "validation/fixtures/f1-f2-f4.fixture.json"
      },
      "ablation": {
        "intervention": "remove read receipts",
        "expected_failure": "reports source offered as read",
        "restoration": "restore item receipts"
      },
      "dependencies": [
        "DNA-05"
      ],
      "status": "CANDIDATE",
      "phenotype_mapping": {
        "product": "APPLIES",
        "harvest": "APPLIES",
        "research": "APPLIES"
      },
      "open_question": "Does a standalone index satisfy competency?"
    },
    {
      "id": "DNA-04",
      "name": "Resource introspection",
      "family": "A",
      "claim": "report measured, estimated or unknown usage and constraints",
      "scope_hypothesis": "UNIVERSAL_CANDIDATE",
      "condition": "Telemetry partially exposed by host",
      "observable_behavior": "Do not fabricate counters or hidden capacity",
      "realization_contract": {
        "inputs": [
          "instrumentation_snapshot"
        ],
        "outputs": [
          "classified_metric_report"
        ],
        "events": [
          "RESOURCE_OBSERVED"
        ]
      },
      "metrics": [
        "unobserved_field_false_measured_rate"
      ],
      "fitness": {
        "probe_id": "F2-U",
        "threshold": "0/2 fabricated UNKNOWN fields; all known values exact",
        "execution_status": "HARNESS_ONLY",
        "fixture_ref": "validation/fixtures/f1-f2-f4.fixture.json"
      },
      "ablation": {
        "intervention": "replace missing counters with token estimate",
        "expected_failure": "UNKNOWN reported as measured",
        "restoration": "restore provenance-labelled counters"
      },
      "dependencies": [],
      "status": "CANDIDATE",
      "phenotype_mapping": {
        "product": "APPLIES",
        "harvest": "APPLIES",
        "research": "APPLIES"
      },
      "open_question": "Can resource honesty remain a thin host wrapper?"
    },
    {
      "id": "DNA-05",
      "name": "Knowledge ingress",
      "family": "B",
      "claim": "account for eligible inputs and actual reading/ingestion with exclusions",
      "scope_hypothesis": "UNIVERSAL_CANDIDATE",
      "condition": "Any task receiving material",
      "observable_behavior": "Distinguish accepted/read/excluded inputs precisely",
      "realization_contract": {
        "inputs": [
          "ingress_manifest"
        ],
        "outputs": [
          "ingestion_receipts"
        ],
        "events": [
          "ITEM_INGESTED"
        ]
      },
      "metrics": [
        "ingress_item_f1"
      ],
      "fitness": {
        "probe_id": "G05",
        "threshold": "1.00 on six mixed eligible/read items",
        "execution_status": "NOT_RUN",
        "fixture_ref": null
      },
      "ablation": {
        "intervention": "disable receipt tracking",
        "expected_failure": "unread items presented as read",
        "restoration": "restore receipt-backed intake"
      },
      "dependencies": [],
      "status": "CANDIDATE",
      "phenotype_mapping": {
        "product": "APPLIES",
        "harvest": "APPLIES",
        "research": "APPLIES"
      },
      "open_question": "Is interpretation-level assimilation measurable separately from receipt?"
    },
    {
      "id": "DNA-06",
      "name": "Cognitive organization",
      "family": "B",
      "claim": "relate concepts, dependencies, provenance and contradictions",
      "scope_hypothesis": "REALIZATION_CANDIDATE",
      "condition": "Knowledge graph/directed relationship workload",
      "observable_behavior": "Answer dependencies across nonlocal concepts",
      "realization_contract": {
        "inputs": [
          "source_dependencies"
        ],
        "outputs": [
          "related_facts"
        ],
        "events": [
          "RELATION_RETRIEVED"
        ]
      },
      "metrics": [
        "relation_recall_at_5"
      ],
      "fitness": {
        "probe_id": "G06",
        "threshold": "at least 0.90 across 20 hidden relation queries",
        "execution_status": "NOT_RUN",
        "fixture_ref": null
      },
      "ablation": {
        "intervention": "disable semantic grouping",
        "expected_failure": "misses cross-file links",
        "restoration": "restore relationship representation"
      },
      "dependencies": [
        "DNA-08"
      ],
      "status": "CANDIDATE",
      "phenotype_mapping": {
        "product": "APPLIES",
        "harvest": "APPLIES",
        "research": "APPLIES"
      },
      "open_question": "Can retrieval alone replace a special organizational gene?"
    },
    {
      "id": "DNA-07",
      "name": "Attention allocation",
      "family": "B",
      "claim": "choose active/retrievable context under measured resource bounds",
      "scope_hypothesis": "REALIZATION_CANDIDATE",
      "condition": "Constrained active-context window",
      "observable_behavior": "Allocate attention without losing required evidence",
      "realization_contract": {
        "inputs": [
          "token_budget_and_queries"
        ],
        "outputs": [
          "context_selection"
        ],
        "events": [
          "CONTEXT_REBALANCED"
        ]
      },
      "metrics": [
        "answer_accuracy_per_1k_tokens"
      ],
      "fitness": {
        "probe_id": "G07",
        "threshold": "quality >= baseline and tokens <= 1.10x in 20 tasks",
        "execution_status": "NOT_RUN",
        "fixture_ref": null
      },
      "ablation": {
        "intervention": "remove selective attention policy",
        "expected_failure": "important citations evicted or cost rises",
        "restoration": "restore selective context policy"
      },
      "dependencies": [
        "DNA-04",
        "DNA-08"
      ],
      "status": "CANDIDATE",
      "phenotype_mapping": {
        "product": "APPLIES",
        "harvest": "APPLIES",
        "research": "APPLIES"
      },
      "open_question": "Optimization strategy or inherited competency?"
    },
    {
      "id": "DNA-08",
      "name": "Retrieval and recall",
      "family": "B",
      "claim": "retrieve relevant supported evidence and recognize incomplete recall",
      "scope_hypothesis": "REALIZATION_CANDIDATE",
      "condition": "Task requires recall",